brand,name,price,rating,ingredients,contains_parabens
LA MER,Crème de la Mer,175.0,4.1,"Algae (Seaweed) Extract, Mineral Oil, Petrolatum, Glycerin, Isohexadecane, Microcrystalline Wax, Lanolin Alcohol, Citrus Aurantifolia (Lime) Extract, Sesamum Indicum (Sesame) Seed Oil, Eucalyptus Globulus (Eucalyptus) Leaf Oil, Sesamum Indicum (Sesame) Seed Powder, Medicago Sativa (Alfalfa) Seed Powder, Helianthus Annuus (Sunflower) Seedcake, Prunus Amygdalus Dulcis (Sweet Almond) Seed Meal, Sodium Gluconate, Copper Gluconate, Calcium Gluconate, Magnesium Gluconate, Zinc Gluconate, Magnesium Sulfate, Paraffin, Tocopheryl Succinate, Niacin, Water, Beta-Carotene, Decyl Oleate, Aluminum Distearate, Octyldodecanol, Citric Acid, Cyanocobalamin, Magnesium Stearate, Panthenol, Limonene, Geraniol, Linalool, Hydroxycitronellal, Citronellol, Benzyl Salicylate, Citral, Sodium Benzoate, Alcohol Denat., Fragrance.

Please be aware that ingredient lists may change or vary from time to time. Please refer to the ingredient list on the product package you receive for the most up to date list of ingredients.",0
SK-II,Facial Treatment Essence,179.0,4.1,"-Pitera™: A bio-ingredient rich in vitamins, organic acids, minerals, and amino acids that work together to support skin’s natural cell renewal process.

Galactomyces Ferment Filtrate (Pitera), Butylene Glycol, Pentylene Glycol, Water, Sodium Benzoate, Methylparaben, Sorbic Acid.",1
DRUNK ELEPHANT,Protini™ Polypeptide Cream,68.0,4.4,"-9 Signal Peptide Complex 
-Pygmy Waterlily Stem Cell Extract 
-Soybean Folic Acid Ferment Extract 

Water, Dicaprylyl Carbonate, Glycerin, Cetearyl Alcohol, Cetearyl Olivate, Sorbitan Olivate, Sclerocarya Birrea Seed Oil, Bacillus/Soybean/ Folic Acid Ferment Extract, Nymphaea Alba Root Extract, sh-Oligopeptide-1, sh-Oligopeptide-2, sh-Polypeptide-1, sh-Polypeptide-9, sh-Polypeptide-11, Copper Palmitoyl Heptapeptide-14, Heptapeptide-15 Palmitate, Palmitoyl Tetrapeptide-7, Palmitoyl Tripeptide-1, Alanine, Arginine, Glycine, Histidine, Isoleucine, Phenylalanine, Proline, Serine, Threonine, Valine, Acetyl Glutamine, Coconut Alkanes , Coco-Caprylate/Caprate, Sodium Hyaluronate, Aspartic Acid, Linoleic Acid, Linolenic Acid, Lecithin, Butylene Glycol, Polyvinyl Alcohol, Sodium Lactate, Sodium PCA, PCA, Sorbitan Isostearate, Carbomer, Polysorbate 20, Polysorbate 60, Lactic Acid/Glycolic Acid Copolymer, Hydroxyethyl Acrylate/Sodium Acryloyldimethyl Taurate Copolymer, Xanthan Gum, Isomalt, 1,2-Hexanediol, Caprylyl Glycol, Chlorphenesin, Phenoxyethanol, Tocopherol, Sodium Benzoate, Phenylpropanol, Glyceryl Caprylate, Symphytum Officinale Callus Culture Extract.",0
LA MER,The Moisturizing Soft Cream,175.0,3.8,"Algae (Seaweed) Extract, Cyclopentasiloxane, Petrolatum, Glyceryl Distearate, Phenyl Trimethicone, Butylene Glycol, Hydrogenated Vegetable Oil, Cholesterol, Butyrospermum Parkii (Shea Butter), Steareth-10, Dimethicone, Glyceryl Stearate Se, Polysilicone-11, Sesamum Indicum (Sesame) Seed Oil, Medicago Sativa (Alfalfa) Seed Powder, Helianthus Annuus (Sunflower) Seedcake, Prunus Amygdalus Dulcis (Sweet Almond) Seed Meal, Eucalyptus Globulus (Eucalyptus) Leaf Oil, Sodium Gluconate, Copper Gluconate, Calcium Gluconate, Magnesium Gluconate, Zinc Gluconate, Tocopheryl Succinate, Niacin, Sesamum Indicum (Sesame) Seed Powder, Water, Citrus Aurantifolia (Lime) Peel Extract, Laminaria Digitata Extract, Crithmum Maritimum Extract, Salicornia Herbacea Extract, Plankton Extract, Chlorella Vulgaris Extract, Glycine Soja (Soybean) Seed Extract, Glycerin, Caffeine, Sea Salt/Maris Sal/Sel Marin, Micrococcus Lysate, Diethylhexyl Succinate, Adenosine Phosphate, Creatine, Hydrolyzed Algin, Isocetyl Stearoyl Stearate, Cetyl Alcohol, Sucrose, Acetyl Hexapeptide-8, Glucose Oxidase, Polyacrylamide, Acetyl Carnitine Hcl, Glucose, Caprylic/Capric Triglyceride, C13-14 Isoparaffin, Tocopheryl Acetate, Tetrahexyldecyl Ascorbate, Sodium Pca, Glycosaminoglycans, Urea, Distearyldimonium Chloride, Dipalmitoyl Hydroxyproline, Sodium Hyaluronate, Laureth-7, Lecithin, Trehalose, Polyquaternium-51, Lactoperoxidase, Hydroxypropyl Cyclodextrin, Cyanocobalamin, Pentylene Glycol, Fragrance, Disodium Edta, Bht, Citronellol, Hydroxycitronellal, Geraniol, Linalool, Limonene, Potassium Sorbate, Phenoxyethanol

Please be aware that ingredient lists may change or vary from time to time. Please refer to the ingredient list on the product package you receive for the most up to date list of ingredients.",0
IT COSMETICS,Your Skin But Better™ CC+™ Cream with SPF 50+,38.0,4.1,"-Collagen: Supports skin elasticity for a youthful, smooth appearance.
-Peptides: Help reduce the appearance of wrinkles and support natural collagen for the look of smoother, firmer skin.
-Niacin: Promotes a more even appearance and helps combat the look of blemishes and hyperpigmentation.
-Antioxidants: Reduce and protect against free-radical damage, which can cause skin inflammation and aging.

Water, Snail Secretion Filtrate, Phenyl Trimethicone, Dimethicone, Butylene Glycol, Butylene Glycol Dicaprylate/Dicaprate, Orbignya Oleifera Seed Oil, Butyloctyl Salicylate, Cetyl Peg/Ppg-10/1 Dimethicone, Cyclopentasiloxane, Cyclohexasiloxane, Magnesium Sulfate, Polyglyceryl-4 Isostearate, Dimethicone/Vinyl Dimethicone Crosspolymer, Aluminum Hydroxide, Hexyl Laurate, Stearic Acid, Calcium Stearate, Caprylyl Glycol, Triethoxycaprylylsilane, Ethylhexylglycerin, Citrus Medica Limonum (Lemon) Peel Oil, Tocopheryl Acetate, Sorbitan Isostearate, Phenoxyethanol, Citrus Aurantium Bergamia (Bergamot) Fruit Oil, 1,2-Hexanediol, Disodium Edta, Citrus Aurantium Dulcis (Orange) Peel Oil, Citrus Aurantifolia (Lime) Oil, Vitis Vinifera (Grape) Seed Oil, Punica Granatum Seed Oil, Pinus Sylvestris Leaf Oil, Persea Gratissima (Avocado) Oil, Niacinamide, Citrus Grandis (Grapefruit) Peel Oil, Cholesterol, Anthemis Nobilis Flower Water, Lactobacillus/Honeysuckle Flower/Licorice Root/Morus Alba Root/Pueraria Lobata Root/Schizandra Chinensis Fruit/Scutellaria Baicalensis Root/Sophora Japonica Flower Extract Ferment Filtrate, Perfluorohexane, Olea Europaea (Olive) Leaf Extract, Glycerin, Eucalyptus Globulus Leaf Oil, Camellia Sinensis Leaf Extract, Chrysanthemum Indicum Flower Extract, Pueraria Lobata Root Extract, Perfluorodecalin, Morus Alba Fruit Extract, Magnolia Kobus Bark Extract, Glycine Soja (Soybean) Sprout Extract, Diospyros Kaki Leaf Extract, Cinnamomum Cassia Bark Extract, Artemisia Princeps Leaf Extract, Pentafluoropropane, Curcuma Longa (Turmeric) Root Extract, Steareth-20, Hydrolyzed Hyaluronic Acid, Colloidal Oatmeal, Hydrolyzed Silk, Citric Acid, Sodium Benzoate, Potassium Sorbate, Aloe Barbadensis Leaf Extract, N-Hydroxysuccinimide, Hydrolyzed Collagen, Caprylhydroxamic Acid, Tocopherol, Thiamine Hcl, Riboflavin, Retinyl Palmitate, Pantothenic Acid, Palmitoyl Oligopeptide, Niacin, Folic Acid, Chrysin, Carnitine Hcl, Biotin, Ascorbic Acid, Palmitoyl Tetrapeptide-7, Chlorhexidine Digluconate. May Contain: Iron Oxides (Ci 77492, Ci 77491, Ci 77499).",0
TATCHA,The Water Cream,68.0,4.2,"-Japanese Wild Rose: Supports natural circulation, balances skin, and improves the look of pores.
-Japanese Leopard Lily: Reduces oil production, calms problem skin, and supports natural turnover of the skin.
-Tatcha's Signature Hadasei-3: Restores a healthy-looking, youthful radiance with nourishing green tea, rice, and algae.

Water, Saccharomyces/Camellia Sinensis Leaf/Cladosiphon Okamuranus/Rice Ferment Filtrate*, Dimethicone, Propanediol, Glycerin, Diglycerin, Diphenylsiloxy Phenyl Trimethicone, Gold, Belamcanda Chinensis Root Extract, Rosa Multiflora Fruit Extract, Houttuynia Cordata Extract, Sophora Angustifolia Root Extract, Sodium Hyaluronate, Lecithin, Pistacia Lentiscus (Mastic) Gum, Sodium Chloride, Sodium Citrate, Mica, Peg-9 Polydimethylsiloxyethyl Dimethicone, Dimethicone/Peg-10/15 Crosspolymer, Dimethicone/Phenyl Vinyl Dimethicone Crosspolymer, Disodium Edta, Tin Oxide, Titanium Dioxide, Butylene Glycol, Ethylhexylglycerin, Parfum/Fragrance, Alcohol, Phenoxyethanol. *Hadasei-3.",0
DRUNK ELEPHANT,Lala Retro™ Whipped Cream,60.0,4.2,"-Blend of Six African Oils: Delivers intense hydration while brightening and rejuvenating skin.
-Plantain Extract: Aids in restoring moisture while brightening. 
-Sodium Hyaluronate Crosspolymer: Has a smaller molecular weight than hyaluronic acid and is able to deeply penetrate skin, delivering excellent hydration and reducing the appearance of fine lines and wrinkles.
-Fermentoil Green Tea Seed: Rich in antioxidants to provide moisturizing and nourishing benefits. 

Water, Glycerin, Caprylic/ Capric Triglyceride, Isopropyl Isostearate, Pseudozyma Epicola/Camellia Sinensis Seed Oil/Glucose/Glycine Soja Meal/Malt Extract/Yeast Extract Ferment Filtrate (Pseudozyma Epicola/Camellia Sinensis Seed Oil/Glucose/Yeast Extract Ferment Filtrate), Stearic Acid, Glyceryl Stearate SE, Cetearyl Alcohol, Pentylene Glycol, Plantago Lanceolata Leaf Extract, Adansonia Digitata Seed Oil, Citrullus Lanatus (Watermelon) Seed Oil, Passiflora Edulis Seed Oil, Schinziophyton Rautanenii Kernel Oil, Sclerocarya Birrea Seed Oil, Polyglyceryl-6 Ximenia Americana Seedate, Sodium Hyaluronate Crosspolymer, Ceteareth-20, Trisodium Ethylenediamine Disuccinate, Sodium Hydroxide, Citric Acid, Carbomer, Xanthan Gum, Caprylyl Glycol, Chlorphenesin, Phenoxyethanol, Ethylhexylglycerin.",0
DRUNK ELEPHANT,Virgin Marula Luxury Facial Oil,72.0,4.4,"-Virgin Marula Oil: Helps nourish and rejuvenate skin for a youthful glow while providing critical antioxidants and omegas 6 and 9, thanks to its super-absorbent qualities. 

100% Unrefined Sclerocraya Birrea (Marula) Kernel Oil.

This product is vegan and gluten-free.",0
KIEHL'S SINCE 1851,Ultra Facial Cream,29.5,4.4,"-Antarcticine (Glacial Glycoprotein Extract): Protects skin from extremely cold temperatures, facilitating skin’s retention of natural water reserves.
-Imperata Cylindrica (Desert Plant Extract): Helps skin to store and retain moisture efficiently, even in the driest weather conditions.
-Squalane: Helps restore skin’s natural moisture balance to keep it extra soft and supple.

Water, Glycerin, Cyclohexasiloxane, Squalane, Bis-Peg-18 Methyl Ether Dimethyl Silane, Sucrose Stearate, Stearyl Alcohol, Peg-8 Stearate, Urea, Myristyl Myristate, Pentaerythrityl Tetraethylhexanoate, Prunus Armeniaca Kernel Oil, Phenoxyethanol, Persea Gratissima Oil, Olea Europaea Oil, Oryza Sativa Bran Oil, Cetyl Alcohol, Glyceryl Stearate, Imperata Cylindrica Root Extract, Stearic Acid, Methylparaben, Chlorphenesin, Palmitic Acid, Disodium Edta, Acrylates/C10-30 Alkyl Acrylate Crosspolymer, Propylparaben, Carbomer, Triethanolamine, Prunus Amygdalus Dulcis Oil, Xanthan Gum, Sodium Hydroxide, Tocopherol, Pseudoalteromonas Ferment Extract, Hydroxypalmitoyl Sphinganine, Caprylyl Glycol.",1
LA MER,Little Miss Miracle Limited-Edition Crème de la Mer,325.0,5.0,"Algae (Seaweed) Extract, Mineral Oil, Petrolatum, Glycerin, Isohexadecane, Microcrystalline Wax, Lanolin Alcohol, Citrus Aurantifolia (Lime) Extract, Sesamum Indicum (Sesame) Seed Oil, Eucalyptus Globulus (Eucalyptus) Leaf Oil, Sesamum Indicum (Sesame) Seed Powder, Medicago Sativa (Alfalfa) Seed Powder, Helianthus Annuus (Sunflower) Seedcake, Prunus Amygdalus Dulcis (Sweet Almond) Seed Meal, Sodium Gluconate, Copper Gluconate, Calcium Gluconate, Magnesium Gluconate, Zinc Gluconate, Magnesium Sulfate, Paraffin, Tocopheryl Succinate, Niacin, Water, Beta-Carotene, Decyl Oleate, Aluminum Distearate, Octyldodecanol, Citric Acid, Cyanocobalamin, Magnesium Stearate, Panthenol, Limonene, Geraniol, Linalool, Hydroxycitronellal, Citronellol, Benzyl Salicylate, Citral, Sodium Benzoate, Alcohol Denat., Fragrance.

Please be aware that ingredient lists may change or vary from time to time. Please refer to the ingredient list on the product package you receive for the most up to date list of ingredients.",0
FRESH,Lotus Youth Preserve Moisturizer,45.0,4.3,"Water, Glycerin, Propylene Glycol Dicaprylate/Dicaprate, Pentylene Glycol, Cetearyl Alcohol, Caprylic/Capric Triglyceride, Cetearyl Isononanoate, Betaine, Polymethyl Methacrylate, Steareth-21, Ficus Carica (Fig) Fruit Extract, Lepidium Meyenii Root Extract, Citrus Limon (Lemon) Peel Oil, Cucumis Sativus (Cucumber) Fruit Extract, Algae Extract, Nelumbo Nucifera Flower Extract, Hibiscus Esculentus Fruit Extract, Sodium Hyaluronate, Tocopheryl Acetate, Ascorbyl Tetraisopalmitate, Tocopherol, Behenyl Alcohol, Cetearyl Glucoside, Sorbitol, Dimethicone, Sodium PCA, Caprylyl Glycol, Carbomer, Tromethamine, Cetyl Alcohol, Stearyl Alcohol, Butylene Glycol, Xanthan Gum, Caramel, Citric Acid, Potassium Sorbate, Sorbic Acid, Phenoxyethanol, Limonene, Citral.",0
KIEHL'S SINCE 1851,Midnight Recovery Concentrate,47.0,4.4,"-Squalane: Helps restore skin’s natural moisture balance to keep it extra soft and supple.
-Lavender Essential Oil: Helps soothe inflamed or irritated skin, while helping reduce skin blotchiness for a more even look.
-Evening Primrose Oil: Boosts radiance and visibly repairs skin’s barrier.

Caprylic/Capric Triglyceride Dicaprylyl Carbonate Squalane Rosa Canina Fruit Oil Oenothera Biennis Oil / Evening Primrose Oil Simmondsia Chinensis Oil / Jojoba Seed Oil Coriandrum Sativum Oil / Coriander Seed Oil Tocopherol Lavandula Angustifolia Oil / Lavender Oil Pelargonium Graveolens Flower Oil Linalool Rosmarinus Officinalis Leaf Oil / Rosemary Leaf Oil Citronellol Geraniol Lavandula Hybrida Oil Cucumis Sativus Extract / Cucumber Fruit Extract Curcuma Longa Extract / Turmeric Root Extract Limonene Citral Sclareolide Rosa Spp / Rose Flower Oil Jasminum Officinale Extract / Jasmine Extract Helianthus Annuus Seed Oil / Sunflower Seed Oil.",0
BELIF,The True Cream Aqua Bomb,38.0,4.5,"-Lady's Mantle: Antioxidant-rich herb with pore-minimizing benefits; helps remove free radicals from skin and aids skin turnaround.
-Malachite: Neutralizes free radical activity.
-Plantin: Creates moisture seal on skin.
-Oat Husk: Attracts moisture.

Water, Dipropylene Glycol, Glycerin, Methl Trimethicone, Alcohol Denat, Dimethicone, Cyclopentasiloxane, 1,2-Hexanediol, Malakite Extract, Caprylic/Capric Triglyceride, Pentaerythrityl Tetraethylhexanoate, PEG/PPG/Polybutylene Glycol-8/5/3 Glycerin, Alchemilla Vulgaris Leaf Extract*, Equisetum Arvense Leaf Extract*, Stellaria Media (Chickweed) Extract*, Urtica Dioica (Nettle) Leaf Extract*, Plantago Lanceolata Leaf Extract*, Avena Sativa (Oat) Kernel Extract**, Calendula Officinalis Flower Extract**, Nepeta Cataria Extract**, Rubus Idaeus (Raspberry) Leaf Extract**, Baptisia Tinctoria Root Extract**, Dimethiconol, Polymethylsilsesquioxane, Sodium Acrylate/Acryloyldimethyltaurate/Dimethylacrylamide Crosspolymer, Isohexadecane, Polysorbate 60, Ceramide 3, Cholesterol, Butyrospermum Parkii (Shea) Butter, Phenl Trimethicone, Pentaerythrityl Tetraisostearate, Panthenol, Squalane, Triethylhexanoin, Macadamia Ternifolia Seed Oil, PEG-150, PEG-40 Hydrogenated Castor Oil, Acrylates/C10-30 Alkyl Acrylate Crosspolymer, C14-22 Alcohols, Arachidyl Glucoside, Hydrogenated Lecithin, PEG-100 Stearate, Stearic Acid, Glyceryl Stearate, Carbomer, Tromethamine, Trisodium EDTA, Fragrance+, Citronellol, Limonene, Citral, Geraniol, Linalool. *Napiers aqua formula. **Napiers original formula. +Fragrances of natural origin.",0
SUNDAY RILEY,Luna Sleeping Night Oil,105.0,4.1,"-Trans-retinoic Acid Ester: Supports healthy skin with the power of retinoids, but without the irritation of traditional retinol; encourages exfoliation and revitalization for the appearance of smoother, younger-looking skin.
-Blue Tansy and German Chamomile: Help to calm and soothe for a reduce the appearance of redness.
-Chia Seed Oil: This richest botanical source of omega 3 also provides alpha-lipoic acid.

Persea Gratissima (Extra Virgin, Cold Pressed Avocado) Oil, Vitis Vinifera (Organic, Cold Pressed Concord Grape) Seed Oil, Rubus Fruticosus (Cold Pressed Blackberry) Seed Oil, Salvia Hispanica (Cold Pressed Chia) Oil, Dimethyl Isosorbide (and) Hydroxypinacolone Retinoate, Chamomilla Recutita (Matricaria) Flower Oil, Tanecetum annuum (Blue Tansy) oil, Anthemis nobilis (English Chamomile) oil, Eriocephalus punctulatus (Cape Chamomile) oil, Citrus Aurantium Amara (Neroli) Oil, Citrus Aurantium Dulcis (Blood Orange) oil, Cananga Odorata Flower (Ylang Ylang) Oil, Vetivera zizanoides (Vetiver) oil, Helianthus Annuus (Sunflower) Seed Oil (and) Rosmarinus officinalis (Rosemary) Leaf Extract, CI 61565 (Green 6), CI 60725 (Violet 2).",0
FARMACY,Honeymoon Glow AHA Resurfacing Night Serum with Echinacea GreenEnvy™,58.0,4.6,"AHA/BHA/Flower Acid Blend 14%:
-AHA from Lactic, Glycolic, Citric, and Fruit Acids: Exfoliate dead skin cells, promote cell renewal, target hyperpigmentation, and help reduce the appearance of pores, fine lines, and wrinkles.
-BHA from Willow Bark: A natural source of salicylic acid; helps reduce the appearance of pores.
-Flower Acids from Hibiscus: Gently exfoliate while moisturizing and reducing the appearance of skin redness.

-Hyaluronic acid: Hydrates and plumps by drawing water to the skin and helping to prevent moisture loss.
-Echinacea GreenEnvy™ Honey: Naturally rich in lactic acid and known for its super soothing and humectant properties, this special honey made only by the bees on the Farmacy farm provides skin-loving moisture and nourishment.

Water, Lactic Acid, Propanediol, Jojoba Esters, Glycolic Acid, Potassium Hydroxide, Salix Alba (Willow) Bark Extract, Carthamus Tinctorius (Safflower) Oleosomes, Vitis Vinifera (Grape) Seed Oil, Hibiscus Sabdariffa Flower Extract, Citric Acid, Honey Extract, Echinacea Purpurea Root Extract, Propolis Extract, Royal Jelly Extract, Hydrolyzed Sodium Hyaluronate, Hydrolyzed Hyaluronic Acid, Curcuma Longa (Turmeric) Root Extract, Argania Spinosa Kernel Oil, Zingiber Officinale (Ginger) Root Extract, Amaranthus Caudatus Seed Oil, Limnanthes Alba (Meadowfoam) Seed Oil, Vaccinium Myrtillus Fruit/Leaf Extract, Saccharum Officinarum (Sugarcane) Extract, Citrus Aurantium Dulcis (Orange) Fruit Extract, Citrus Limon (Lemon) Fruit Extract, Acer Saccharum (Sugar Maple) Extract, Melia Azadirachta Leaf Extract, Helianthus Annuus (Sunflower) Seed Oil, Melia Azadirachta Flower Extract, Salvia Hispanica Seed Oil, Cetearyl Alcohol, Glycerin, Arachidyl Alcohol, Sclerotium Gum, Coco-Glucoside, Polyacrylate Crosspolymer-6, Behenyl Alcohol, Arachidyl Glucoside, Sodium Benzoate, Tocopherol, Potassium Sorbate, Corallina Officinalis Extract, Polyglyceryl-10 Stearate, Gluconolactone, 1,2-Hexanediol, Ocimum Basilicum (Basil) Flower/Leaf Extract, Ocimum Sanctum Leaf Extract, T-Butyl Alcohol, Glucose, Calcium Gluconate, Citral.",0
DRUNK ELEPHANT,The Littles™,90.0,4.4,"Beste™ No.9 Jelly Cleanser:
Water, Sodium Lauroyl Methyl Isethionate, Glycerin, Cocamidopropyl Betaine, Cocamidopropyl Hydroxysultaine, Sodium Methyl Oleoyl Taurate, Propanediol, Aloe Barbadensis Leaf Extract, Coco-Glucoside, Lauryl Glucoside, Cucumis Melo Cantalupensis Fruit Extract, Sclerocarya Birrea Seed Oil, Dipotassium Glycyrrhizate, Citric Acid, Phenoxyethanol, Sodium Benzoate, Sodium Chloride.

C-Firma™ Day Serum:
Water, Ethoxydiglycol, Ascorbic Acid, Glycerin, Laureth-23, Lactobacillus/Pumpkin Ferment Extract, Sclerocarya Birrea Seed Oil, Ferulic Acid, Sodium Hyaluronate, Chondrus Crispus Extract, Camellia Sinensis Leaf Extract, Lactobacillus/Punica Granatum Fruit Ferment Extract, Glycyrrhiza Glabra (Licorice) Root Extract, Vitis Vinifera (Grape) Juice Extract, Phyllanthus Emblica Fruit Extract, Hydrolyzed Wheat Protein, Tocopherol, Caprylhydroxamic Acid, Acetyl Glucosamine, Hydrolyzed Quinoa, Glutamylamidoethyl Imidazole, Dipotassium Glycyrrhizate, Tetrahydrodiferuloylmethane, Tetrahydrodemethoxydiferuloylmethane, Tetrahydrobisdemethoxydiferuloylmethane, Sodium Hyaluronate Crosspolymer, Glycine, Sucrose, Maltodextrin, Propanediol, Caprylyl Glycol, Sodium Hydroxide, Xanthan gum, Hydroxyethyl Acrylate/Sodium Acryloyldimethyl Taurate Copolymer, Isohexadecane, Polysorbate 60.

B-Hydra™ Intensive Hydration Serum:
Water,Coconut Alkanes, Ammonium Acryloyldimethyltaurate/VP Copolymer, Glycerin, Pentylene Glycol, Sclerocarya Birrea Seed Oil, Wheat Amino Acids, Ananas Sativus (Pineapple) Fruit Extract, Berberis Vulgaris Root Extract, Citrullus Lanatus (Watermelon) Fruit Extract, Lens Esculenta (Lentil) Fruit Extract, Pyrus Malus (Apple) Fruit Extract, Coco-Caprylate/Caprate, Panthenol, Sodium PCA, Sodium Hyaluronate Crosspolymer, Dipotassium Glycyrrhizate, Niacinamide, Cyclodextrin, Sodium Hyaluronate, Sodium Lactate, Phenoxyethanol, Hydroxyproline, Trisodium Ethylenediamine Disuccinate, Citric Acid, Caprylyl Glycol, Chlorphenesin, Ethylhexylglycerin.

T.L.C. Framboos™ Glycolic Night Serum:
Water, Glycolic Acid, Butylene Glycol, Glycerin, Sodium Hydroxide, Salicylic Acid, Lactic Acid, Citric Acid, Vitis Vinifera (Grape) Juice Extract, Aloe Barbadensis Leaf Juice, Opuntia Ficus-Indica Extract, Aesculus Hippocastanum (Horse Chestnut) Seed Extract, Camellia Sinensis Leaf Extract, Rubus Idaeus (Raspberry) Fruit Extract, Saccharomyces Cerevisiae Extract, Buddleja Davidii Meristem Cell Culture, Sclerocarya Birrea Seed Oil, Sodium Hyaluronate Crosspolymer, Allantoin, Hydroxyethylcellulose, Galactoarabinan, Propanediol, Disodium EDTA, Xanthan Gum, Hexylene Glycol, Phenoxyethanol, Caprylyl Glycol, Ethylhexylglycerin, Sodium Nitrate, Potassium Sorbate, Pentylene Glycol, Sodium Benzoate.

Virgin Marula Luxury Facial Oil:
Sclerocarya Birrea Seed OilLala Retro™Whipped CreamWater,Glycerin, Caprylic/ Capric Triglyceride, Isopropyl Isostearate, Pseudozyma Epicola/Camellia Sinensis Seed Oil/Glucose/Glycine Soja Meal/Malt Extract/Yeast Extract Ferment Filtrate (Pseudozyma Epicola/Camellia Sinensis Seed Oil/Glucose/Yeast Extract Ferment Filtrate), Stearic Acid, Glyceryl Stearate SE, Cetearyl Alcohol, Pentylene Glycol, Plantago Lanceolata Leaf Extract, Adansonia Digitata Seed Oil, Citrullus Lanatus (Watermelon) Seed Oil, Passiflora Edulis Seed Oil, Schinziophyton Rautanenii Kernel Oil, Sclerocarya Birrea Seed Oil, Polyglyceryl-6 Ximenia Americana Seedate, Sodium Hyaluronate Crosspolymer, Ceteareth-20, Trisodium Ethylenediamine Disuccinate, Sodium Hydroxide, Citric Acid, Carbomer, Xanthan Gum, Caprylyl Glycol, Chlorphenesin, Phenoxyethanol, Ethylhexylglycerin.

Umbra™ Sheer Physical Daily Defense SPF 30:
Zinc Oxide 20%, Water, Caprylic/Capric Triglyceride, Dicaprylyl Carbonate, Glycerin,Pentylene Glycol, Steareth-2, Propanediol, Steareth-21, Polyhydroxystearic Acid, Cetearyl Alcohol, Silica, Sclerocarya Birrea Seed Oil, Aloe Barbadensis Leaf Extract, Chondrus Crispus Extract, Haematococcus Pluvialis Extract, Helianthus Annuus (Sunflower) Sprout Extract, Vitis Vinifera (Grape) Juice Extract, Helianthus Annuus (Sunflower) Seed Oil, Simmondsia Chinensis (Jojoba) Seed Oil, Raspberry Seed Oil/Tocopheryl Succinate Aminopropanediol Esters, Hydrolyzed Wheat Protein,Tocopheryl Acetate, Tocopherol, Sea Water, Acetyl Glucosamine, Cetearyl Glucoside, Sodium Stearoyl Glutamate, Tetrahexyldecyl Ascorbate, Glycine, Sucrose, Lecithin, Triethoxycaprylylsilane, Xanthan Gum, Trisodium Ethylenediamine Disuccinate, Caprylhydroxamic Acid, Mica, Caprylyl Glycol, Phenoxyethanol, Titanium Dioxide (CI 77891), Iron Oxides (CI 77491).

Shaba Complex™ Eye Serum:
Water, Octyldodecanol, Glycerin, Boron Nitride, Saccharomyces/Xylinum/Black Tea Ferment, Coconut Alkanes, Cetyl Alcohol, Cetearyl Olivate, Sorbitan Olivate, Niacinamide, Copper Tripeptide-1, Leontopodium Alpinum Meristem Cell Culture, Dipeptide-2, Palmitoyl Tripeptide-1, Palmitoyl Tetrapeptide-7, Copper Lysinate/Prolinate, Hesperidin Methyl Chalcone, Chondrus Crispus (Carrageenan), Mangifera Indica (Mango) Seed Butter, Glycine Soja (Soybean) Oil, Hippophae Rhamnoides Oil, Sclerocarya Birrea Seed Oil, Sodium Hyaluronate Crosspolymer, Hydroxyethylcellulose, Coco-Caprylate/Caprate, Steareth-20, Lecithin, Panthenol, N-Hydroxysuccinimide, Ubiquinone, Citric Acid, Thioctic Acid, Tocopherol, Chrysin, Sclerotium Gum, Methylglucoside Phosphate, Xanthan Gum, Potassium Sorbate, Sodium Benzoate, Chlorphenesin, Caprylyl Glycol, Sodium Hydroxide, Phenoxyethanol, Pentylene Glycol, Ethylhexylglycerin.",0
FIRST AID BEAUTY,Ultra Repair® Cream Intense Hydration,30.0,4.6,"-Colloidal Oatmeal (OTC): FDA-designated skin protectant that relieves itching and minor irritation caused by eczema, rashes, and other skin conditions.
-Shea Butter: Moisturizes and protects the skin barrier with vitamins, minerals, and essential fatty acids.
-Allantoin: Calms and soothes skin.
-Ceramides: Strengthens the skin barrier and moisturizes skin.

Water, Stearic Acid, Glycerin, C12-15 Alkyl Benzoate, Caprylic/Capric Triglyceride, Glyceryl Stearate Se, Glyceryl Stearate, Cetearyl Alcohol, Butyrospermum Parkii Butter, Dimethicone, Squalane, Allantoin, Camellia Sinensis Leaf Extract, Caprylyl Glycol, Ceramide 3, Chrysanthemum Parthenium Extract, Colloidal Oatmeal, Disodium EDTA, Eucalyptus Globulus Leaf Oil, Glycyrrhiza Glabra Root Extract, Sodium Hydroxide, Xanthan Gum, Phenoxyethanol.",0
