brand,name,price,rating,ingredients,contains_parabens
Clinique,Repairwear Laser Focus Wrinkle Correcting Eye Cream,47.0,4.5,"Water / Aqua / Eau, Squalane, Butylene Glycol, Ethylhexyl Palmitate, Glycerin, Caprylic / Capric / Myristic / Stearic Triglyceride, Dimethicone, Methyl Gluceth-20, PEG-100 Stearate, Cetyl Alcohol, Glyceryl Stearate, PEG-8, Polymethylsilsesquioxane, Hydrogenated Lecithin, Hypnea Musciformis (Algae) Extract, Gellidiela Acerosa (Algae) Extract, Sigesbeckia Orientalis (St. Paul'S Wort) Extract, Crithmum Maritimum Extract, Hordeum Vulgare (Barley) Extract / Extrait D'Orge, Chlorella Vulgaris Extract, Cucumis Sativus (Cucumber) Fruit Extract, Rosmarinus Officinalis (Rosemary) Leaf Extract, Padina Pavonica Thallus Extract, Laminaria Digitata Extract, Camellia Sinensis Leaf Extract, Saccharomyces Ferment Filtrate, Whey Protein / Lactis Protein / ProtÃ©ine Du Petit-Lait, Hydrogenated Vegetable Oil, Micrococcus Lysate, Persea Gratissima (Avocado) Sterols, Ergothioneine, Biotin, Acetyl Glucosamine, Caffeine, Lecithin, Palmitoyl Oligopeptide, Glyceryl Polymethacrylate, Caprylic / Capric Triglyceride, Polysilicone-11, Propylene Glycol Dicaprate, Tocopheryl Acetate, Sucrose, Trehalose, Pentylene Glycol, Carbomer, Helianthus Annuus (Sunflower) Seedcake, Tromethamine, Phytosphingosine, Tetrahexyldecyl Ascorbate, Cholesterol, Zinc PCA, Hexylene Glycol, Hydroxyethylcellulose, Sodium Hyaluronate, Potassium Sulfate, Citric Acid, Caprylyl Glycol, Sodium Citrate, Disodium Distyrylbiphenyl Disulfonate, Disodium EDTA, Phenoxyethanol, Titanium Dioxide (CI 77891).

Please be aware that ingredient lists may change or vary from time to time. Please refer to the ingredient list on the product package you receive for the most up to date list of ingredients.",0
Clinique,Clinique iD Dramatically Different For Lines & Wrinkles,39.5,3.6,"Water\Aqua\Eau, Bis-PEG-18 Methyl Ether Dimethyl Silane, Butylene Glycol, Glycerin, Cucumis Sativus (Cucumber) Fruit Extract, Hypnea Musciformis (Algae) Extract, Gelidiella Acerosa Extract, Hordeum Vulgare (Barley) Extract\Extrait D'Orge, Padina Pavonica Thallus Extract, Helianthus Annuus (Sunflower) Seedcake, Sucrose, Caffeine, Sodium Hyaluronate, Hydroxyethyl Urea, Hydrolyzed Rice Extract, Sorbitol, Sodium Polyaspartate, PPG-6-Decyltetradeceth-30, Ethylhexylglycerin, Propylene Glycol Dicaprate, Caprylyl Glycol, Trehalose, Polysorbate 80, Carbomer, Sodium Hydroxide, Hexylene Glycol, Citric Acid, Sodium Citrate, Disodium EDTA, Phenoxyethanol.",0
LancÃ´me,Bienfait Multi-Vital SPF 30 Day Cream Moisturizer,56.0,4.7,"Water, Dimethicone, Glycerin, Alcohol Denat., Vp/Eicosene Copolymer, Hydrogenated Polyisobutene, Aluminum Starch Octenylsuccinate, Sucrose Stearate, Silica, Poly C10-30 Alkyl Acrylate, Ribes Nigrum (Black Currant) Seed Oil, Tocopheryl Acetate, Ascorbyl Glucoside, Sodium Polyacrylate, Sodium Hydroxide, Hydroxycitronellal, Hydroxyisohexyl 3-Cyclohexene Carboxaldehyde, Phenoxyethanol, Stearic Acid, Thermus Thermophillus Ferment, Eugenol, Ethylparaben, Triethanolamine, Palmitic Acid, Helianthus Annuus (Sunflower) Seed Oil, Dimethiconol, Panthenol, Xanthan Gum, Benzyl Salicylate, Benzyl Alcohol, Linalool, Oxothiazolidinecarboxylic Acid, Caprylyl Glycol, Alpha-Isomethyl Ionone, Acrylates/C10-30 Alkyl Acrylate Crosspolymer, Geraniol, Moringa Pterygosperma Seed Extract, Disodium EDTA, Castanea Sativa (Chestnut) Seed Extract, Rosa Canina Fruit Oil, Methylparaben, Citronellol, Hexyldecanol, Hexyldecyl Laurate, Hexyl Cinnamal. Fragrance.",1
Neutrogena,Hydro Boost City Shield Water Gel Sunscreen SPF 25,28.99,4.5,"Active: Avobenzone 2%, Homosalate 4%, Octisalate 4%, Octocrylene 2%. Inactive: Water, Glycerin, Caprylyl Methicone, Methyl Methacrylate Crosspolymer, Pentylene Glycol, Sodium Acryloyldimethyltaurate/VP Crosspolymer, Phenoxyethanol, Glyceryl Stearate, Chlorphenesin, Tocopheryl Acetate, Sodium Hyaluronate, Disodium EDTA, Ethylhexylglycerin, Fragrance, Sodium Hydroxide, Blue 1, Red 40.",0
Murad,Hydro-Dynamic Ultimate Moisture,75.0,4.5,"Water (Aqua), C12-15 Alkyl Benzoate, Caprylic/Capric Triglyceride, Glycerin, Helianthus Annuus (Sunflower) Seed Oil, Butylene Glycol, Glyceryl Stearate, Glyceryl Behenate/Eicosadioate, Dicaprylyl Carbonate, Butyrospermum Parkii (Shea Butter), Cetearyl Alcohol, Myristyl Myristate, Cetyl Alcohol, Ethoxydiglycol, Phenyl Trimethicone, Stearic Acid, Avena Sativa (Oat) Kernel Extract, Yeast Extract (Faex), Algae Extract, Glycine Soja (Soybean) Sterols, Zea Mays (Corn) Starch, Olea Europaea (Olive) Fruit Oil, Persea Gratissima (Avocado) Oil, Sodium Hyaluronate, Dipotassium Glycyrrhizate, Tetrahexyldecyl Ascorbate, Tocopheryl Acetate, Linoleic Acid, Phospholipids, Polysorbate 60, Acrylamide/Sodium Acryloyldimethyltaurate Copolymer, Isohexadecane, Glyceryl Polymethacrylate, Panthenol, Jojoba Alcohol, Potassium Jojobate, Polysorbate 80, Urea, Glucosamine HCl, PEG-8, Bisabolol, Sorbitan Oleate, Cetearyl Methicone, Dimethicone, Palmitoyl Oligopeptide, Retinyl Palmitate, Allantoin, Xanthan Gum, Disodium EDTA, BHT, Ethylhexylglycerin, Chlorphenesin, Phenoxyethanol.",0
Murad,Intense Recovery Cream,80.0,4.7,"Water/Aqua/Eau, Ethylhexyl Palmitate, Betaine, Cetearyl Methicone, Cetearyl Alcohol, Cetyl Myristate, Stearyl Dimethicone, Macadamia Ternifolia Seed Oil, Pyrus Malus (Apple) Fruit Extract, Glycerin, Butylene Glycol, Butyrospermum Parkii (Shea) Butter, Polyglyceryl-3 Polydimethylsiloxyethyl Dimethicone, Polysorbate 60, Dimethicone, Behenyl Alcohol, Glycol Distearate, Mentha Viridis (Spearmint) Leaf Oil, Pogostemon Cablin Oil, Citrus Medica Limonum (Lemon) Peel Oil, Lavandula Hybrida Oil, Mentha Arvensis Leaf Oil, Cedrus Atlantica Bark Oil, Chlorella Emersonii Extract, Mirabilis Jalapa Extract, Tocopherol, Helianthus Annuus (Sunflower) Seed Extract, Coccinia Indica Fruit Extract, Solanum Melongena (Eggplant) Fruit Extract, Ocimum Sanctum Leaf Extract, Curcuma Longa (Tumeric) Root Extract, Corallina Officinalis Extract, Ocimum Basilicum (Basil) Flower/Leaf Extract, Simmondsia Chinesis (Jojoba) Seed Oil, Aloe Barbadensis Flower Extract, Melia Azadirachta Leaf Extract, Melia Azadirachta Flower Extract, Urea, Yeast Amino Acids, Trehalose, Inositol, Taurine, Xanthan Gum, Propanediol, Octadecene, Polysorbate 20, Sodium Hydroxide, Disodium EDTA, Hexylene Glycol, Ethylhexylglycerin, Caprylyl Glycol, Phenoxyethanol, Limonene, Linalool.",0
SUNDAY RILEY,Ice Ceramide Moisturizing Cream,65.0,4.3,"Extract Blend [Water/Eau/Aqua, Chondrus Crispus (Red Algae) Extract], Squalane, C13-15 Alkane (from Sugarcane), Glycerin, Helianthus Annuus (Sunflower) Seed Wax, Lanolin Alcohol, Tri(Polyglyceryl-3/Lauryl) Hydrogenated Trilinoleate, Cocos Nucifera (Coconut) Fruit Extract, Ceramide NP, Ceramide EOP, Ceramide AP, Sodium Hyaluronate, Linoleic Acid, Oleic Acid, Palmitic Acid, Linolenic Acid, Prunus Amygdalus Dulcis (Sweet Almond) Fruit Extract, Fructooligosaccharides, Beta Vulgaris (Beet) Root Extract, Shea Butter Ethyl Esters, Prunus Armeniaca (Apricot) Fruit Extract, Pimpinella Anisum (Anise) Fruit Extract, Rubus Idaeus (Raspberry) Fruit Extract, Vanilla Planifolia Fruit Extract, Cucumis Melo (Melon) Fruit Extract, Punica Granatum Sterols, Rosa Damascena Flower Oil, Ananas Sativus (Pineapple) Fruit Extract, Cinnamomum Cassia Leaf Oil, Ricinus Communis (Castor) Seed Oil, Rhus Verniciflua Peel Wax/Rhus Succedanea Fruit Wax, Sodium Lauroyl Lactylate, Sodium Polyacryloyldimethyl Taurate, Triethyl Citrate, Tapioca Starch, Sodium Benzoate, Potassium Sorbate, Sodium Phytate, Magnesium Stearate, Magnesium Aspartate, Pentylene Glycol, Tocopherol, Phytosphingosine, Cholesterol, Lithothamnion Calcareum Extract, Zinc Gluconate, Stearic Acid, Copper Gluconate, Phenoxyethanol, Polymethylsilsesquioxane, Xanthan Gum, Carbomer.",0
CurÃ©l,Intensive Moisture Facial Cream,30.0,4.7,"Water/Aqua, Glycerin, Cetyl-PG Hydroxyethyl Palmitamide, Cyclopentasiloxane, Squalane, Risiloxane, Dimethicone, PEG-3 Dimethicone, Allantoin, Magnesium Sulfate, Butylene Glycol, Isostearyl Glyceryl Ether, PEG-12 Dimethicone, Succinic Acid, Sodium Hydroxide, Bis-Methoxypropylamido Isodocosane, Eucalyptus Globulus Leaf Extract, Tocopherol, Methylparaben.",1
Philosophy,Purity Made Simple Moisturizer,28.0,4.5,"Aqua/Water/Eau, Cyclopentasiloxane, Bis-PEG-18 Methyl Ether Dimethyl Silane, Glycerin, Butylene Glycol, Butyrospermum Parkii (Shea) Butter, Glyceryl Stearate, PEG-100 Stearate, Cetearyl Alcohol, Cetyl Alcohol, Limnanthes Alba (Meadowfoam) Seed Oil, Phenoxyethanol, Stearic Acid, Tocopheryl Acetate, Salvia Hispanica Seed Oil, Panthenol, Parfum/Fragrance, Acrylates/C10-30 Alkyl Acrylate Crosspolymer, Linalool, BHT, Ascorbyl Glucoside, Disodium EDTA, Sodium Hydroxide, PEG-8, Tocopherol, Sodium Hyaluronate, Lecithin, Alcohol Denat., Geraniol, Polyglyceryl-3 Diisostearate, Pantolactone, Ascorbyl Palmitate, Citronellol, Camellia Sinensis Leaf Extract, Coffea Arabica (Coffee) Seed Extract, Pongamia Pinnata Seed Extract, Benzyl Benzoate, Limonene, Ascorbic Acid, Angelica Archangelica Root Extract, Citrus Aurantium Amara (Bitter Orange) Peel Extract, Maltodextrin, Citric Acid, Magnesium Aluminum Silicate, Xanthan Gum, Caprylyl Glycol, Sclerotium Gum, Sorbic Acid, Fd&Amp;C Yellow No. 5 (CI 19140), Fd&Amp;C Yellow No. 6 (CI 15985).",0
La Roche-Posay,Anthelios 50 Daily Face Primer with Sunscreen SPF 50,39.99,4.3,"Active: Avobenzone 3% (Sunscreen), Homosalate 10% (Sunscreen), Octisalate 5% (Sunscreen), Octocrylene 5% (Sunscreen), Oxybenzone 6% (Sunscreen).

Inactive: Dimethicone, C12-15 Alkyl Benzoate, Talc, Diisopropyl Sebacate, Silica Silylate, Glycerin, Trimethylsiloxysilicate, Dimethicone Crosspolymer, Water, Diethylhexyl Sryingylidenemalonate, Cassia Alata Leaf Extract, Maltodextrin.",0
GLAMGLOW,GLOWSTARTER Mega Illuminating Hyaluronic Acid Moisturizer,50.0,4.0,"Water\Aqua\Eau, Dimethicone, Butylene Glycol, Glyceryl Distearate, Cetyl Ricinoleate, Trisiloxane, Glyceryl Stearate Se, Cholesterol, Steareth-10, Simmondsia Chinensis (Jojoba) Seed Oil, Butyrospermum Parkii (Shea Butter), Cetyl Esters, Cetyl Alcohol, Glycerin, Tocopheryl Acetate, Sodium Hyaluronate, Algae Extract, Camellia Sinensis (Green Tea) Leaf Extract, Cucumis Sativus (Cucumber) Fruit Extract, Pyrus Malus (Apple) Fruit Extract, Saccharomyces Lysate Extract, Scutellaria Baicalensis Root Extract, Ceramide Ng, Isohexadecane, Synthetic Fluorphlogopite, Sucrose, Polysorbate 80, Acrylamide/Sodium Acryloyldimethyltaurate Copolymer, Xanthan Gum, Caprylyl Glycol, Hexylene Glycol, Citric Acid, Linoleic Acid, Panthenol, Fragrance (Parfum), Limonene, Citral, Linalool, Disodium Edta, Magnesium Ascorbyl Phosphate, Sodium Citrate, Phenoxyethanol. May Contain: Mica, Titanium Dioxide (Ci 77891), Iron Oxides (Ci 77491), Iron Oxides (Ci 77492), Iron Oxides (Ci 77499), Blue 1 (Ci 42090), Red 4 (Ci 14700), Red 33 (Ci 17200), Yellow 5 (Ci 19140).",0
It Cosmetics,Confidence in a Cream Rosy Tone Skin Brightening Moisturizer,49.0,4.5,"Aqua / Water / Eau, Squalane, Cyclohexasiloxane, Glycerin, Cetyl Alcohol, Glyceryl Stearate, PEG-40 Stearate, Myristyl Myristate, Pentaerythrityl Tetraethylhexanoate, Octyldodecanol, Sorbitan Tristearate, Butylene Glycol, Phenoxyethanol, Acrylamide/Sodium Acryloyldimethyltaurate Copolymer, Synthetic Fluorphlogopite, CI 77891 / Titanium Dioxide, Isohexadecane, Silica, Capryloyl Salicylic Acid, Ascorbyl Glucoside, Chlorphenesin, Mica, Polysorbate 80, Parfum / Fragrance, Paeonia Albiflora Root Extract, Disodium EDTA, CI 77163 / Bismuth Oxychloride, CI 77491 / Iron Oxides, Hydrolyzed Cicer Seed Extract, Tocopherol, Niacinamide, Sodium Hyaluronate, Aloe Barbadensis Leaf Juice, Caprylic/Capric Triglyceride, Sorbitan Oleate, Sodium Hydroxide, Iris Florentina Root Extract, Vigna Aconitifolia Seed Extract, Propylene Glycol, Sodium Cocoyl Glutamate, Hexyl Cinnamal, Tin Oxide, Limonene, Glucose, Chamomilla Recutita Flower Extract / Matricaria Flower Extract, Ceteareth-25, Soluble Collagen, Sodium Benzoate, Citric Acid, Urtica Dioica Extract / Nettle Extract, Equisetum Arvense Extract, Betula Alba Leaf Extract, Potassium Sorbate, Camellia Sinensis Leaf Extract, Rose Extract, Dipeptide Diaminobutyroyl Benzylamide Diacetate, Ceramide Np, Behenic Acid, Cholesterol, Trisodium Edta, Ceramide Ns, Ethylhexylglycerin, Ceramide Ap, Ceramide Eop, Ceramide Eos, Caprooyl Phytosphingosine, Caprooyl Sphingosine, Ascorbyl Palmitate.",0
Clinique,Clinique For Men Anti-Age Moisturizer,41.0,4.5,"Water\Aqua\Eau , Squalane , Glycerin , Isostearyl Neopentanoate , Butyrospermum Parkii (Shea Butter) , Butylene Glycol , Peg-100 Stearate , Cetyl Alcohol , Dimethicone , Polyethylene , Glyceryl Stearate , Cucumis Sativus (Cucumber) Fruit Extract , Hordeum Vulgare (Barley) Extract\Extrait D'Orge , Sigesbeckia Orientalis (St. Paul'S Wort) Extract , Whey Protein\Lactis Protein\ProtÃ©ine Du Petit-Lait , Caffeine , Acetyl Hexapeptide-8 , Sucrose , Petrolatum , Sodium Polyacrylate , Acetyl Glucosamine , Caprylyl Glycol , Propylene Glycol Dicaprate , Helianthus Annuus (Sunflower) Seedcake , Glyceryl Polymethacrylate , Palmitoyl Oligopeptide , Tocopheryl Acetate , Sodium Hyaluronate , Dimethicone Crosspolymer-3 , Hexylene Glycol , Ptfe , Peg-8 , Xanthan Gum , Disodium Edta , Phenoxyethanol.

Please be aware that ingredient lists may change or vary from time to time. Please refer to the ingredient list on the product package you receive for the most up to date list of ingredients.",0
ELEMIS,Pro-Collagen Marine Cream SPF 30,128.0,4.8,"Water, Glycerin, Caprylic/Capric Triglyceride, Glyceryl Stearate SE, Isononyl Isononanoate, Dicaprylyl Carbonate, Dimethicone, Phenoxyethanol, Polyacrylate-13, Butylene Glycol, Cetyl Alcohol, Hydroxyacetophenone, Stearic Acid, Tocopheryl Acetate, Coco-Caprylate, Xanthan Gum, Chlorphenesin, Polyisobutene, Fragrance, Disodium EDTA, Lecithin, Tocopherol, Butyrospermum Parkii (Shea) Butter, Daucus Carota Sativa (Carrot) Root Extract, Triticum Vulgare (Wheat) Germ Oil, Chlorella Vulgaris Extract, Glyceryl Polyacrylate, Glyceryl Acrylate/Acrylic Acid Copolymer, Padina Pavonica Thallus Extract, Sodium Dehydroacetate, Polysorbate 20, Sorbitan Isostearate, Ginkgo Biloba Leaf Extract, Porphyridium Cruentum Extract, Acacia Decurrens (Mimosa) Flower Extract, Rosa Centifolia (Rose) Flower Extract, Sodium Benzoate, Potassium Sorbate, Citric Acid.

Sunscreen Active: Avobenzone 1.0%, Octionoxate 1.0%, Octocrylene 0.5%.",0
Honest Beauty,Hydrogel Cream,20.0,4.2,"Water (aqua), Squalane, Glycerin, Polyglyceryl-4 Lsostearate, Pyrus Malus (apple) Fruit Extract, Coco-caprylate/caprate, Propanediol, Disteardimonium Hectorite, Jojoba Esters, Sodium Pca, Tocopherol, Sodium Acetylated Hyaluronate, Hydrolyzed Sodium Hyaluronate, Trisodium Ethylenediamine Disuccinate, 1,2-hexanediol, Caprylhydroxamic Acid.",0
Clarins,Extra-Firming Wrinkle Control Firming Day Cream Broad Spectrum SPF 15 All Skin Types,88.0,4.3,"Active: Avobenzone 3%, Homosalate 9%, Octocrylene 6,5%.
Inactive: Aqua/Water/Eau,Glycerin, Butyloctyl Salicylate, Butyrospermum Parkii (Shea) Butter, Dimethicone,C12-15 Alkyl Benzoate,Cetearyl Alcohol, Methyl Methacrylate Crosspolymer, Potassium Cetyl Phosphate, Parfum/Fragrance, Cetearyl Glucoside, Dimethicone/Vinyl Dimethicone Crosspolymer, Phenoxyethanol, Butylene Glycol, Acrylates/C10-30 Alkyl Acrylate Crosspolymer, Caprylyl Glycol, Tromethamine, Avena Sativa (Oat) Kernel Extract, Disodium EDTA,Tocopheryl Acetate, Xanthan Gum, Dimethiconol, Tocopherol, Anigozanthos Flavidus Extract, Caprylic/Capric Triglyceride, Betaine, Silica, Sorbitol, Diospyros Mespiliformis Leaf Extract, Maltodextrin, Sanicula Europaea Extract, Sodium Benzoate, Kalanchoe Pinnata Leaf Extract, Balanites Roxburghii Seed Oil, Mitracarpus Scaber Extract, Citric Acid, Malpighia Emarginata (Acerola) Seed Extract, Lapsana Communis Flower/Leaf/Stem Extract,Furcellaria Lumbricalis Extract, CI 15985/Yellow 6, Potassium Sorbate, Maris Sal/Sea Salt/Sel Marin.",0
EstÃ©e Lauder,Resilience Multi-Effect Tri-Peptide Face and Neck Creme SPF 15,95.0,4.4,"Active: Avobenzone 3.0%, Octisalate 4.5%, Octocrylene 2.7%. Inactive: Water\Aqua\Eau, Neopentyl Glycol Diheptanoate, Cetyl Alcohol, Glycerin, Butyloctyl Salicylate, Pentaerythrityl Tetraethylhexanoate, Polyethylene, Di-C12-15 Alkyl Fumarate, Petrolatum, Hydrogenated Lecithin, Butylene Glycol, Propanediol, Hydrogenated Polyisobutene, Octyldodecyl Myristate Hexyldecyl Stearate, Behenyl Alcohol, Cucumis Melo (Melon) Fruit Extract, Polygonum Aviculare Extract, Myrtus Communis Leaf Extract, Laminaria Digitata Extract, Acetyl Hexapeptide-8, Tetradecyl Aminobutyroylvalylaminobutyric Urea Trifluoroacetate, Lactoperoxidase, Glucose Oxidase, Cholesterol, Propylene Glycol Dicaprylate, Aminopropyl Ascorbyl Phosphate, Sodium Hyaluronate, Glucose, Algae Extract, Artemia Extract, Acetyl Glucosamine, Sigesbeckia Orientalis (St. Paul'S Wort) Extract, Glyceryl Stearate, Persea Gratissima (Avocado) Oil, Dimethicone, C12-16 Alcohols, Trehalose, Ethylhexylglycerin, Peg-100 Stearate, Caffeine, Palmitic Acid, Glycine Soja (Soybean) Sterols, Caprylyl Glycol, Isohexadecane, Polymethyl Methacrylate, Trifluoroacetyl Tripeptide-2, Tocopheryl Acetate, Zinc PCA, Polysilicone-11, Polysorbate 80, Yeast Extract\Faex\Extrait De Levure, Potato Starch Modified, Decarboxy Carnosine HCL, Xanthan Gum, Fragrance (Parfum), Sodium Hydroxide, Potassium Sulfate, Acrylamide/Sodium Acryloyldimethyltaurate Copolymer, Dextran, Hexylene Glycol, Disodium EDTA, BHT, Potassium Sorbate, Phenoxyethanol, Red 4 (CI 14700), Mica, Titanium Dioxide (CI 77891).

Please be aware that ingredient lists may change or vary from time to time. Please refer to the ingredient list on the product package you receive for the most up to date list of ingredients.",0
Exuviance,Age Reverse Day Repair SPF 30,75.0,4.5,"Active: Avobenzone 3% Octinoxate 7.5% Octisalate 5%.

inactive: Aqua/water/eau, Acetyl Glucosamine, Butyloctyl Salicylate,cyclopentasiloxane, Glyceryl Stearate, Butylene Glycol,butyrospermum Parkii (shea) Butter, PEG-100 Stearate,dimethicone, Cetyl Alcohol, Nylon-12, Triacontanyl Pvp,retinol, Citric Acid, Palmitoyl Tripeptide-1, Palmitoyltetrapeptide-7, Coffea Arabica (coffee) Fruit Extract, Tocopherylacetate, Rosa Damascena Flower Oil, Punica Granatum Extract,arginine, Glycerin, Propylene Glycol, Cyclohexasiloxane,caprylyl Glycol, Dimethiconol, Disodium EDTA, BHT, Xanthangum, PEG-75 Stearate, Ceteth-20, Steareth-20, Polysorbate 20,triethyl Citrate, Ammonium Acryloyldimethyltaurate/vpcopolymer, Methyldihydrojasmonate, Carbomer, Ethylenebrassylate, Phenoxyethanol, Chlorphenesin, Yellow 5 (CI 19140),red 33 (CI 17200).",0
Olay,Total Effects Anti-Aging Moisturizer With SPF 30,24.99,4.4,"Water, Glycerin, Polymethylsilsesquioxane, Niacinamide, Polyethylene, Pentylene Glycol, Tocopheryl Acetate, Panthenol, Dimethicone, Acrylamide/Sodium Acryloyldimethyltaurate Copolymer, Benzyl Alcohol, Stearyl Alcohol, Hydroxyethyl Acrylate/Sodium Acryloyldimethyl Taurate Copolymer, Behenyl Alcohol, PEG-100 Stearate, Cetyl Alcohol, C13-14 Isoparaffin, Isohexadecane, Methylparaben, Fragrance, Ethylparaben, Propylparaben, Cetearyl Glucoside, Cetearyl Alcohol, Dimethiconol, Laureth-7, Polysorbate 60, Stearic Acid, Disodium EDTA, Iodopropynyl Butylcarbamate, Titanium Dioxide.",1
Olay,Regenerist Fragrance-Free Micro-Sculpting Cream,28.99,4.6,"Water, Glycerin, Isohexadecane, Niacinamide, Isopropyl Isostearate, Aluminum Starch Octenylsuccinate, Nylon-12, Dimethicone, Panthenol, Tocopheryl Acetate, Palmitoyl Pentapeptide-4, Sodium Peg-7 Olive Oil Carboxylate, Sodium Hyaluronate, Caprylic/Capric Triglyceride, Ceratonia Siliqua (Carob) Fruit Extract, Stearyl Alcohol, Polyethylene, Cetyl Alcohol, Behenyl Alcohol, Sodium Acrylates Copolymer, Titanium Dioxide, Benzyl Alcohol, Methylparaben, Ethylparaben, Dimethiconol, Polyacrylamide, Peg-100 Stearate, Propylparaben, Cetearyl Glucoside, Cetearyl Alcohol, C13-14 Isoparaffin, Disodium Edta, Citric Acid, Stearic Acid, Palmitic Acid, C12-13 Pareth-3, Laureth-7, Sodium Hydroxide, Mica.",1
StriVectin,Tightening & Sculpting Face Cream,95.0,4.4,"Aqua (Water, Eau), Stearic Acid, Neopentyl Glycol Diethylhexanoate, C12-15 Alkyl Benzoate, Cyclopentasiloxane, Glycol Distearate, Cetearyl Alcohol, Myristyl Nicotinate, Phenoxyethanol, Cetyl Alcohol, Butylene Glycol, Butyrospermum Parkii (Shea) Butter, Polysorbate 60, Isostearyl Isostearate, Potassium Cetyl Phosphate, Cetyl Stearate, Acrylates/C10-30 Alkyl Acrylate Crosspolymer, Sucrose Palmitate, Tocopherol, Pullulan, Allantoin, Panthenol, Orinthine, Propanediol, Phospholipids, Caprylic/Capric Triglyceride, Ethylhexylglycerin, Aesculus Hippocastanum (Horse Chestnut) Bark Extract, Disodium EDTA, Paeonia Albiflora Root Extract, Sodium Hydroxide, Glyceryl Linoleate, Nannochloropsis Oculata Extract, Sorbitan Laurate, Glycolipids, Sodium Hyaluronate, Commiphora Mukul Resin Extract, Hydroxyethylcellulose, Acetyl Dipeptide-1 Cetyl Ester, Potassium Sorbate, Citric Acid, Fragrance (Parfum).",0
CeraVe,Skin Renewing Day Cream SPF 30,24.99,3.3,"Active: Octinoxate 7.5 %, Zinc Oxide 10.5 %. Inactive: Water, Cyclomethicone, Pentylene Glycol, Phenyl Trimethicone, Cetearyl Alcohol, PED-40 Stearate, Dimethicone, Glycerin, Stearyl Alcohol, Phenoxyethanol, Hydraxyethyl Acrylate, Sodium Acryloyldimethyl Taurate Copolymer, Ceramide 3, Ceramide 6-11, Ceramide 1, Potassium Cetyl Phosphate, Squalane, Phytosphingosine, Cholesterol, Lecithin, Hydrogenated Palm Glycerides, Behentrimonium Methosulface, Polysorbate 60, Hyaluronic Acid, Retinol, Disodium EDTA, Xanthan Gum, Iris Florentina Root Extract, Ceteareth-20, Polysilicone-11, Polysorbate 20, Chlorphenesin, Sodium Lauroyl Lactylate, Tetra-Hexyldecyl Ascorbate, Alcohol, Butylene Glycol, Ethylhexylglycerin, Dimethicone Crosspolymer-3, Sodium Polyacrylate, Sodium Hydroxide, Carbomer, Citric Acid.",0
Tula,Super Soothe Calming Moisturizing Lotion,46.0,4.4,"Aqua/Water/Eau, Glycerin, C13-15 Alkane, Propanediol, Squalane, Cetearyl Olivate, Jojoba Esters, Hydrogenated Olive Oil, Sorbitan Olivate, Lactococcus Ferment Lysate, Sclerotium Gum, Butyrospermum Parkii (Shea) Butter, Opuntia Ficus-Indica Fruit Extract, Olea Europaea (Olive) Fruit Oil, Colloidal Oatmeal, Hydroxyacetophenone, 1,2-Hexanediol, Caprylyl Glycol, Helianthus Annuus (Sunflower) Seed Extract, Olea Europaea (Olive) Oil Unsaponifiables, Saccharomyces Cerevisiae Extract, Cucumis Sativus (Cucumber) Fruit Extract, Trisodium Ethylenediamine Disuccinate, Hordeum Vulgare Extract, Agastache Mexicana Flower/Leaf/Stem Extract, Zingiber Officinale (Ginger) Root Extract, Phenoxyethanol, Lactic Acid, Maltodextrin, Sodium Benzoate, Sodium Chloride, Potassium Sorbate, Aloe Barbadensis Leaf Juice, Tocopherol, Linum Usitatissimum (Linseed) Seed Extract.",0
Tula,Dew Your Thing Oil Free Gel Cream,48.0,4.7,"Aqua/Water/Eau, Pro-panediol, Cyclopentasiloxane, Cyclo-hexasiloxane, Caprylyl Methicone, Dimethicone, Aspergillus/Rice Ferment, Lactococcus Ferment Lysate, Saccharomyces/Rice Ferment Filtrate, Lactic Acid, Aloe Barbadensis Flower Extract, Sodium Yaluronate, Citrullus Lanatus (Watermelon) Fruit Extract, Coccinia Indica Fruit Extract, Corallina Officinalis Extract, Curcuma Longa (Turmeric) Root Extract, Lens Esculenta (Lentil) Fruit Extract, Melia Azadirachta Flower Extract, Melia Azadirachta Leaf Extract, Ocimum Sanctum Leaf Extract, Opuntia Ficus-indica (Organic Prickly Pear) Stem Extract, Pyrus Malus (Apple) Fruit Extract, Chondrus Crispus Extract, So-lanum Melongena (Eggplant) Fruit Extract, Glycerin, Gluconolactone, Panthenol, Pantolactone, Sodium Lactate, Sodium Pca, Tocopherol, Saccharide Isomerate, Sodium Benzoate, Sodium Chloride, Sodium Citrate, Citric Acid, Caprylhydroxamic Acid, Caprylyl Glycol, Cetyl Peg/Ppg-10/1 Dimethicone, Dimethicone/Peg-10/15 Crosspolymer, Dipropylene Glycol, 1,2- Hexanediol, Butylene Glycol, Potassium Sorbate,Ethylhexylglycerin, Parfum/Fragrance, Phenoxyethanol.",0
e.l.f. Cosmetics,SuperHydrate Moisturizer,12.0,4.1,"Water (Aqua), Butylene Glycol, Glycerin, Dimethicone, PEG-240/HDI copolymer bis-decyltetradeceth-20 ether, Niacinamide, Trehalose, Squalane, Centella Asiatica Extract, Tremella Fuciformis Sporocarp Extract, Tocopheryl Acetate (Ve), Tocopherol , Propanediol, 1,2-Hexanediol, Gellan gum, Acrylates/C10-30 Alkyl Acrylate Crosspolymer, Caprylhydroxamic Acid, Tromethamine, Sodium Chloride, Sodium Citrate, Potassium laurate, Sodium Benzoate, Potassium Sorbate, Phenoxyethanol, Ethylhexylglycerin.",0
Josie Maran,Whipped Argan Oil Face Butter,42.0,4.7,"Aqua (Water)**, Argania Spinosa (Argan) Kernel Oil*, Glyceryl Stearate**, Glycerin**, Cetyl Alcohol**, Butyrospermum Parkii (Shea) Butter **, Dicapryl Carbonate**, Ethylhexyl (Octyl) Palmitate**, Hydroxyethyl Acrylate/Sodium Acryloyl Dimethyl Taurate Copolymer**, Caprylic/Capric Triglyceride**, Xylitylglucoside**, Aloe Barbadensis (Aloe Vera) Leaf Juice*, Anhydroxylitol**, Sodium Stearoyl Glutamate**, Squalane**, Xylitol, Glyceryl Caprylate, Polysorbate-60, Stearic Acid**, Glyceryl Undecylenate, Cucumis Sativus (Cucumber) Fruit Extract**, Xanthan Gum**, Citric Acid**, Lysolecithin**, Tocopherol**, Citrullus Lanatus (Watermelon) Extract**, Phenoxyethanol, Sclerotium Gum**, Ethylhexylglycerin**, Allantoin**, Potassium Sorbate**, Sodium Phytate**, Panthenol**, Sodium Hyaluronate**, Pullulan**.

*Organic
**Naturally-derived",0
